,title,score,id,url,comms_num,created,body,topcomment,comment2,date
178,Kristaps Porzingis or John Collins?,0,brw42k,https://www.reddit.com/r/nba/comments/brw42k/kristaps_porzingis_or_john_collins/,49,1558597959.0,"In their best seasons, John Collins had a higher TS%, Rebound%, Assist Rate, VORP and WS/48. Their box score numbers are close as well: https://www.basketball-reference.com/play-index/pcm_finder.fcgi?request=1&sum=0&player_id1_select=Kristaps+Porzingis&player_id1=porzikr01&y1=2018&y2=2019&player_id2=collijo01&idx=players

But his defense is real assy. Nothing more to say about that, he fouls too much when he tries so I guess he stopped trying this year.  Kristaps is significantly better on that end.",[deleted],"I would take Porzingis easily..what he brings to a team is arguably the most unique out of any player in the league. John Collins is very good, but his general play style doesn't do a whole lot for me",2019-05-23 10:52:39
179,"[Townsend] Appears that Porzingis will not speak to media today, at least that’s the plan. Obviously there are questions that, legally, he doesn’t want to be put on the spot being asked.",43,bc2utz,https://twitter.com/townbrad/status/1116395967341891585?s=21,44,1555033606.0,,Probably should stay away from media until the whole situation is resolved tbh,"""Did you rape that girl?""

KP: ""I was just trying to be aggressive. Tried to execute. Oh wait... What'd you ask?""",2019-04-12 04:46:46
180,[Stein] Memphis is said to be seeking multiple first-round picks in exchange for Conley ... and we have seen two deals in the last week (Porzingis and Tobias) that had teams (Dallas and Philly) willing to go to those lengths.,352,antlof,https://twitter.com/thesteinline/status/1093210909131132928?s=21,130,1549505594.0,,Conely is older and more expensive than both of them,Porzingis and Tobias are 23 and 26 respectively. Conley is 31. They can't possibly expect multiple first rounders for him.,2019-02-07 04:13:14
181,[SI] The Porzingis Trade Was Smart—Even If Knicks Fans Are Losing Their Minds,167,am2ods,https://www.si.com/nba/2019/02/01/knicks-trade-kristaps-porzingis-free-agency-kevin-durant-rumors?xid=socialflow_twitter_si&utm_source=twitter.com&utm_campaign=thecrossover&utm_medium=social,184,1549061023.0,,Acting like getting KD is a given is not smart,This trade is going to look really smart when we end up maxing Tobias Harris and Boogie cousins in the off season.,2019-02-02 00:43:43
182,"[Wojnarowski] The Knicks and Mavericks have scheduled a trade call with the league office to finalize Porzingis deal, sources tell @ramonashelburne.",321,alug6x,https://twitter.com/wojespn/status/1091085315782176769,110,1548998807.0,,This may be the fastest trade deal in the history of all the trade deals.,All those who swipe down instead of actual F5ing say 'aye',2019-02-01 07:26:47
183,[Boone] Harrison Barnes appears to be done for the night. He's sitting at the end of the bench past Kristaps Porzingis.,588,anze2g,https://mobile.twitter.com/rodboone/status/1093350182002085888,75,1549538859.0,,Is he aware that he got traded or?,This should have never been released before the game ended,2019-02-07 13:27:39
184,"Ex-NBA player thinks Kevin Durant should consider signing with Mavs to play with Luka Doncic, Kristaps Porzingis",0,bzc11o,https://sportsday.dallasnews.com/dallas-mavericks/mavericks/2019/06/06/ex-nba-player-thinks-kevin-durant-consider-signing-mavs-play-luka-doncic-kristaps-porzingis,24,1560285963.0,,The ex NBA player ? Dirk.,"Probably not the best time to post a 4 day old article about KDs free agency

The player mentioned is Scal",2019-06-11 23:46:03
185,"In retrospect, are we wrong to blame Phil Jackson when he tried to trade Porzingis during his peak value?",347,alvfbn,https://www.reddit.com/r/nba/comments/alvfbn/in_retrospect_are_we_wrong_to_blame_phil_jackson/,124,1549004400.0,"Phil Jax had the intuition and foresight that the Zinger won't re-sign the Knicks, so he put it out there he would be willing to listen to crazy offers.  Porzingis was off a career season back then, Phil Jax could absolutely get a haul for him during his sky-high trade value with contract year still committed.  Were we too quick to judge Phil for his move?",I’d love to see what Phil Jackson could have gotten at the time for the man called Zing. ,Phil died for our sins 😤,2019-02-01 09:00:00
186,Knicks fans booing over porzingis,0,c72ls7,https://www.reddit.com/r/nba/comments/c72ls7/knicks_fans_booing_over_porzingis/,11,1561860775.0,"So i know the main reasons the Fans at draft night werent happy about the Knicks picking him: soft, unknown from Europe etc.

I am just curious which playerl the fans back then wanted to have. Looking at the list Guys Like cauley-stein, mudiay and Stanley Johnson were following. Which prospect back in the days would have satisfied them, more specifically who had a good College career and people were hyped about ??",Tingus Pingus!,I wanted Mudiay or Winslow,2019-06-30 05:12:55
187,Is Kristaps Porzingis a good defender?,4,bomsyj,https://www.reddit.com/r/nba/comments/bomsyj/is_kristaps_porzingis_a_good_defender/,32,1557888232.0,"There's no doubt that Porzingis is a great offensive player and has been like that in past few seasons.

However, I'm curious to know on how good he actually his on defense?

I don't really follow any Knicks games if I'm honest, so I'd happy with response.","He's quite good. Perimeter defense & knowing exactly when to help still needs a lot of fine-tuning, but that makes sense, he is young. He is an absolutely elite rim protector.",Porzingis was statistically the #1 rim protector in the league in his most recent healthy season.,2019-05-15 05:43:52
188,"[Gambadoro] Reports that Suns said no to a Porzingis for Josh Jackson swap is inaccurate. What did happen was the Suns offered New York the 4th overall pick, both Miami first-round picks and a young player for Porzingis and the Knicks said NO.",257,am77ld,https://twitter.com/gambo987/status/1091452696857501696?s=21,76,1549086436.0,,What the hell?,None of you can read goddamn it lol. This was the Phoenix offer from two years ago,2019-02-02 07:47:16
189,"Kristaps Porzingis on Luka Doncic : “There's no college kid that would be able to put up those kinds of numbers at the highest levels in Europe, playing against professionals, grown men. And he's so young with such confidence, it's unbelievable.”",14676,8tlir8,https://www.complex.com/sports/2018/04/kristaps-porzingis-tells-us-luka-doncic-is-the-best-player-in-the-2018-nba-draft,1175,1529908434.0,,God I can’t wait for the first Doncic vs Porzingis matchup. Doncic sauced all over Latvia at last years EuroBasket ,God I'm so fucking hard. Give me another quote praising him,2018-06-25 09:33:54
190,"The Hours after Kristaps Porzingis’ heartbreaking Injury. Article from April 2018 detailing Porzingis’ time spent after the injury, allegedly was with his brother/Agent Janis.",84,b7hi8f,https://nypost.com/2018/04/19/the-hours-after-kristaps-porzingis-heartbreak-tequila-shots/?_gl=1*rujy5h*_ga*YW1wLTg4d21oOHlpT1laejU2SnFTcFR2V0tvZUpPbmp2TkxIQ2YzY2tKNnhFOFdNMDI1RHJPYWJEVmFUV3JzMkliVVU.,39,1554018076.0,,Reddit detectives never sleep,"We don’t know how long they were with him. Allegedly, the assault was at 2am",2019-03-31 10:41:16
191,"[O'Connor] The Dallas Mavericks are also expected to pursue a trade for Kristaps Porzingis, per league sources.",420,altwfx,https://www.twitter.com/KevinOConnorNBA/status/1091072613655277569,87,1548995773.0,,I haven't done shit at work all afternoon.,"Lmao with what assets 

Edit: WTF LMAOOOOOOO WTF THIS IS SO GREAT OMG",2019-02-01 06:36:13
192,[Ian Begley] DeAndre Jordan will wear Kristaps Porzingis’ old number with the Knicks:,579,amjql5,https://twitter.com/IanBegley/status/1091838886752460801,60,1549178632.0,,DeAndre Jordan will wear DeAndre Jordan's old number with the Knicks.,"That's just DJs number.  Porzingis was on the team for 3 years, who gives a shit",2019-02-03 09:23:52
193,[Fisher] Daily Mail NYPD source calls rape claim a ‘ridiculous accusation without merit.’ Adding #Porzingis and accuser “had a consensual sexual ongoing relationship ... that continued well after the alleged incident.’ - @1053thefan,31,b7v88g,https://twitter.com/fishsports/status/1112517407392833541?s=21,50,1554108932.0,,well if the daily mail says it it must be true,"The daily mail is extremely unreliable 

I don’t doubt that they had an ongoing sexual relationship because that’s been reported by legitimate outlets tho, the rest seems to be a DM exclusive ",2019-04-01 11:55:32
194,"[MacMahon] Kristaps Porzingis on the current state of his recovery: ""I feel great. I feel bouncy and I’m ready to get back on the court.”",399,an5feh,https://www.reddit.com/r/nba/comments/an5feh/macmahon_kristaps_porzingis_on_the_current_state/,71,1549338296.0,"[Original tweet](https://twitter.com/espn_macmahon/status/1092508814090350593)

>The plan is for Kristaps Porzingis to sit out the rest of the season, but he is encouraged with his progress recovering from a torn ACL in his left knee. “I feel great,” he said. “I feel bouncy and I’m ready to get back on the court.”",Lmao,"So he's ok sitting out the season with the Mavericks, but not the Knicks? I understand that. ",2019-02-05 05:44:56
195,"[ESPN] Dirk on the Mavs adding Kristaps Porzingis: ""If you have a chance to add a franchise-caliber player like Porzingis you've just gotta go for it...We wouldn't have made the deal if we thought he was going to walk obviously...he's going to get healthy and play well for us. We'll go from there.""",816,am0fx6,http://www.espn.com/nba/story/_/id/25896992/mavericks-dirk-nowitzki-says-kristaps-porzingis-franchise-player,67,1549043008.0,,Haha dirk on playing with Tim Hardaway Sr and now THJ: “that’s kind of sad.”,Dirk sounding like a GM here,2019-02-01 19:43:28
196,Was the Porzingis trade an example of the right way to deal with a trade request?,8,blsjgd,https://www.reddit.com/r/nba/comments/blsjgd/was_the_porzingis_trade_an_example_of_the_right/,16,1557274154.0,"Porzingis said ""let me out of here"" and was packing in an hour, is this the right way of dealing with a trade request?",Both paries were happy. Knicks dont risk their future by committing to an injured big man and open up capspace for the likes of kd and kyrie and he gets to be someone elses problem. win win,"I can't believe I'm saying this but yes.

With big public trade requests the second you start waiting the less you're likely to get. Look at PG, Kawhi and Butler all three teams ended up settling for less than they would have gotten if they acted sooner.

The problem with waiting is that rosters start being set, coaches start liking players and schemes with those players, players get drafted and play in summer league, free agents sign etc.

Harder to convince a team to make a big change to their roster in September when everyone is optimistic about their chances than in February when everyone is desperate to fix their roster issues.",2019-05-08 03:09:14
197,[Marks] Kristaps Porzingis will miss his 42nd game vs. Indiana and will now see his Qualifying Offer drop from $7.5M to $4.5M. Porzingis has a $17.1M cap hold and is eligible this summer for a five-year $158M contract with a starting salary of $27.25M.,549,aeybz4,https://twitter.com/BobbyMarks42/status/1083719841733849088?s=19,121,1547260376.0,,"Doesn't matter much, he's still gonna accept the max from us",Random question: I can’t imagine the damage an acl injury does for someone that tall. There’s no hesitation for the Knicks giving him a max?,2019-01-12 04:32:56
198,Does anybody think CJ McCollum is better than Bradley Beal?,584,d93fcy,https://www.reddit.com/r/nba/comments/d93fcy/does_anybody_think_cj_mccollum_is_better_than/,462,1569447562.0,"ESPN's top 100 list inexplicably has CJ at 13 and Beal at 19. Between them are Gobert, Simmons, Doncic, Kemba, and KAT (why tf is KAT 18 and behind Doncic), so apparently there is a big gap between them

I'm curious if anyone actually thinks CJ is noticeably better than Beal, and in what ways? Because this list makes absolutely zero sense to me

https://www.espn.com/nba/story/_/id/27691396/ranking-best-players-nba-season-30-11","The list is just supposed to generate reactions, I don't think ESPN really cares about the accuracy of their takes they just want people to watch them and react to them and give them views.","As a fair and unbiased party, I think Beal is better.",2019-09-26 00:39:22
199,"In his 4 year NBA career, Kristaps Porzingis has played 1 game after March. ONE (1)",330,alvsdt,https://www.reddit.com/r/nba/comments/alvsdt/in_his_4_year_nba_career_kristaps_porzingis_has/,74,1549007577.0,"People fell in love with the IDEA of Porzingis (an athletic 7’3 guy who can shoot a little) more than Porzingis’ actual production.

Kristaps Porzingis is horribly injury prone, doesn't rebound, doesn't pass, & scores inefficiently

H/t Sports Тalk Jоe","Embiid had a few years of injuries as well. No doubt it's a risk but when the talent level is worth it, teams will take that risk. Mavs and most others feel his talent level is worthy",Are you including *this* year in that despite that fact that we're only in January?,2019-02-01 09:52:57
200,Forcing your way out of a team should not be commended,1243,dai0ff,https://www.reddit.com/r/nba/comments/dai0ff/forcing_your_way_out_of_a_team_should_not_be/,723,1569715988.0,"While a lot of people in the media have praised Paul George and Kawhi Leonard (besides Skip Bayless) for forcing their way out of their respective teams, I think it's pretty damn unprofessional. You signed a long-term contract to play for that team. The team has every right to transfer that contract to another team via a trade but the player shouldn't be able to do the same. It's really discouraging when a player can sign a 5 year deal and then just quit on the team. 

In particular, this sub had a lot of praise for Porzingis, Jimmy Butler and Kyrie for the way they left their respective teams. Trust me when I say I'm the biggest Knicks hater in the world but even I'll admit he was a bitch for that regardless of how shit the team is (although everybody knows the Knicks will always be shit). If you sign a deal with a team, you should honor that contract.","The NBA is a cruel place. The average player gets traded and moved around without a say in the matter a bunch of times in their career. The power is really skewed towards the owners. However when you get to the superstars, the power is heavily in favour of the player. The owners have to respect and go along with what the superstars want because they are the ones who make the NBA so profitable",Jimmy didn't sign with Minnesota...,2019-09-29 03:13:08
201,Kristaps Porzingis goes off on a Bucks assistant coach on Instagram. Regarding Kanter and Giannis confrontation tn,372,aa782u,https://i.imgur.com/pKesjtt_d.jpg?maxwidth=640&shape=thumb&fidelity=medium,144,1546002515.0,,Read the FOH in DeMars voice,European Prozingis talking like a born and bred bronx boy  foh ,2018-12-28 15:08:35
202,"Willy Hernangomez on his best friend Porzingis: “I will try to get him here. I’m his friend. I would love to play with him (again). I will say, “KP., come here!’ I’ve already told him; he knows how amazing Charlotte is. If he would come here, we’d sure welcome him. If not, we’ll play against him.”",163,am5vng,https://streamable.com/ui9jw,69,1549078648.0,,"### **Replays/alternate angles**
                


*I am a bot, and this action was performed automatically. Please [contact the moderators of this subreddit](/message/compose/?to=/r/nba) if you have any questions or concerns.*",tAmPeRiNg,2019-02-02 05:37:28
203,"[Stein] The lure of playing in one of the league's most attractive markets along with the way the Knicks have positioned themselves to pursue marquee free agents after trading away their franchise player, Kristaps Porzingis, have resonated with Davis.",86,ao0rdr,https://twitter.com/TheSteinLine/status/1093390919133466624,111,1549548651.0,,The Knicks are either going to have the craziest offseason ever or they are going to have the biggest fall from grace since Reddit came into existence. No middle ground ,It would be nice to live in Manhattan with a $30m/yr salary. Can’t blame any star for wanting to go there,2019-02-07 16:10:51
204,"[KnicksFilmSchool] Steve Mills says the team prepared for the possibility that Porzingis didn’t want to be a Knick, so they explored trades and had 8 scenarios identified that they would have felt comfortable with.",211,amsdos,https://twitter.com/KnickFilmSchool/status/1092128766992809985?s=19,78,1549247673.0,,I would love to know the others,Can't wait until KP fires off another cryptic passive aggressive IG story...sigh.,2019-02-04 04:34:33
205,I miss Porzingis,564,acsbqa,https://www.reddit.com/r/nba/comments/acsbqa/i_miss_porzingis/,81,1546705064.0,Dude was so fun to watch in his first two years. Hope you get better soon Kristaps.,Porzingis is tanking for Zion,He’s doing the now classic embiid move - stay injured for a season or two to help the team tank and get a number 1 pick. Then come back and destroy the league with that number 1 pick ,2019-01-05 18:17:44
206,Kristaps Porzingis works on Pick + Roll Jumper &amp; Mid-Range Jumper with Rick Carlisle,58,atlcp5,https://www.youtube.com/watch?v=_M_hmxfs07M,84,1550890627.0,,Dang the Mavs about to be nice with it. Is there a nickname yet for Doncic+Porzingis?," hype videos of him shooting around unguarded, just like melo taught him",2019-02-23 04:57:07
207,"Nine Months After ACL Surgery, Kristaps Porzingis Still Can't Run",929,9vfr7g,https://deadspin.com/nine-months-after-acl-surgery-kristaps-porzingis-still-1830325353,241,1541753021.0,,he just posted an IG story of him running on an athletic track fwiw lol,"Eh, I can't either.",2018-11-09 10:43:41
208,[Charania] New York Knicks‘ Kristaps Porzingis has made good progress from left ACL surgery and will be re-evaluated in mid-February.,902,a8ecgf,https://twitter.com/ShamsCharania/status/1076221007592022016,99,1545454863.0,,Everyone saying he shouldn't play this year but I think he should do the Paul George. Come back with a small number of games left to to try to get your feel back and then hopefully they can get the ground running in 2019,Just rest him this year.,2018-12-22 07:01:03
209,[Begley] Sources: meeting between the Knicks and Kristaps Porzingis on Thursday lasted less than five minutes; NYK had several offers for Porzingis when they made the trade with Dallas.,127,alyq9u,https://www.twitter.com/IanBegley/status/1091205041032171520,100,1549027356.0,,"“Hey I don’t like the way this franchise is going but I’m willing to work thro-“


“We traded you”


“Oh....did you get like a really good offer you couldn’t turn dow-“

“Yeah we got the Mavs backup point guard”",Damn knicks and porzingis broke up quick af,2019-02-01 15:22:36
210,For people who haven't seen Porzingis playing yet,32,b1wy74,https://www.reddit.com/r/nba/comments/b1wy74/for_people_who_havent_seen_porzingis_playing_yet/,49,1552797037.0,[Looks like KP is having fun a little bit. I wish to see him playing in last Mavs game this season if Dirk really retires. Many people probably would want to see at least one game of KP+Luka+Dirk](https://twitter.com/laurakeeney/status/1106375710111875072?s=21),Euros to the rescue,"Mavs just instantly became the city of Utah's second favourite team



",2019-03-17 06:30:37
