,title,score,id,url,comms_num,created,body,topcomment,comment2,date
0,Kristaps Porzingis boasting jacked arms ahead of NBA return,15,cqf02y,https://nypost.com/2019/08/14/kristaps-porzingis-boasting-jacked-arms-ahead-of-nba-return/,34,1565841598.0,,Wow he actually put a lot of size on,I thought shit on NYK day was Tuesday?,2019-08-15 06:59:58
1,"Who is gonna get booed the most? Kyrie,AD,Porzingis or PG?",12,clrtrd,https://www.reddit.com/r/nba/comments/clrtrd/who_is_gonna_get_booed_the_most_kyrieadporzingis/,62,1564918523.0,"Who’s most likely to get booed when they return to their old arenas.

Rank them from 1-4

Like 

Kyrie-Porzingis-AD-PG",porzingis no question,Kyrie,2019-08-04 14:35:23
2,Did Dallas truly beat the Knicks in the KP trade?,0,cqgz75,https://www.reddit.com/r/nba/comments/cqgz75/did_dallas_truly_beat_the_knicks_in_the_kp_trade/,22,1565850372.0,"Last season in the league:

Julius Randle (21.4 ppg, 8.1 rpg, 3.1 ast, 55.5% efg, 24.7 years old, played 310 games last 4 years, no long term injury since rookie year, makes 21 million per over 2 years with a 3rd year team option in summer 2021)

 Kristaps Porzingis (22.7 ppg, 6.6 rpg, 1.2 ast, 49% efg, 24.0 years old, 186 games last 4 years which is less than Tatum, coming off torn ACL at 7’3 with torn ligaments, 32 million per over 5 years w/player option) 

\*Remember losing KP also gave the Knicks two 1st rounders, DSJ, about 40 million in salary, and an open spot at PF to sign Randle in the first place 

Personally, I gotta give it to the Knicks and here is why. While KP clearly has the higher ceiling he is not only coming off an ACL injury at 7'3, but also is set to make 11 million more per year which allows the Knicks another 2nd max slot going forward that a 32 million dollar max signing wouldn't allow them. Not to mention KP got the Knicks DSJ (who is still a young player that's a league average jumper away from having a DLo type year imo), and 2 first round picks in 2021/2023. I mean, if KP reaches his ceiling and Randle stagnates or gets worse I could see this backfiring but until KP proves he is a top 10-15 player, I just don't see how Dallas won this trade.",Randle is completely irrelevant to the trade,Why have i seen “julius is basically just as good as porzingis” multiple times today? Stop it. No.,2019-08-15 09:26:12
3,Kristaps Porzingis Mavericks Debut Highlights,41,dfqybt,https://youtu.be/t34IWAI6IiA,73,1570700302.0,,Anyone citing his 18/7 needs to realize he only played 19 minutes,career high 7 rebounds,2019-10-10 12:38:22
4,[Highlight] Porzingis with his first Mavs bucket,2088,dfp6y0,https://streamable.com/f6mic,292,1570691739.0,,"**Replays/alternate angles**

*I am a bot, and this action was performed automatically. Please [contact the moderators of this subreddit](/message/compose/?to=/r/nba) if you have any questions or concerns.*",Why does he look 10 years older,2019-10-10 10:15:39
5,"[Wojnarowski] New York has agreed with Dallas on trade that includes Kristaps Porzingis, Courtney Lee, Tim Hardaway Jr., for Wesley Matthews, Dennis Smith Jr. and DeAndre Jordan, league sources tell ESPN. Players and agents are being notified of particulars. Deal may include more draft assets.",28188,alu2ds,https://twitter.com/wojespn/status/1091076373765124108,5416,1548996668.0,,Yes officer this trade right here,Cuban’s thoughts: Must. Collect. Europeans. ,2019-02-01 06:51:08
6,"Alan Hahn states that within Kristaps Porzingis's tenure as a Knick, that there was more than 2 more incidents that New York did not let get out.",37,da27yw,https://www.reddit.com/r/nba/comments/da27yw/alan_hahn_states_that_within_kristaps_porzingiss/,68,1569627793.0,"So this is from the Knicks Fan TV podcast where they had Alan Hahn (who is the host of the Knicks post game show) & was a former player himself. 

When a caller asks him to discern **what happened with the Kristaps Porzingis era and how could we only hear about the rape accusations after his tenure as a Knick**

He states that 

**That incident that KP was apart of, and I know of there was two other things that I know of that never got out, that will not get out""**

Alan goes on to state that when the trade was announced, everyone failed him because it came to this; including his brother & apparently;

**""The kid was immature about some things, that the team did all it could to take care of him, they really did. What he was unhappy about, he'll never talk about it, maybe eventually""**

The host asks him **"" Do you think it was the whole Phil tenure?""**

Alan states;

**""Yes I think it started there, it continued there and I don't think -I know Fizdale tried it but they were able to just not able to  get back in the fold, & he went from this kid who had the key to the gym ""oh I can go to the gym whenever I want, I love that"" to sliding into DMS,hanging out a lil more than he should and sideeyeing everyone when they talked about how much he meant to the franchise""**


There's a lot more just generally about the Knicks but here's a Spotify link to the specific time when it's brought up;

[46:63min mark is when it's brought up](https://open.spotify.com/episode/65ZsRWVKKm9oHzqg82CkDq?si=6CXmtY6PRtepnPL5-K3rgg)","Alan Hahn is a shill and this is his standard playbook from when players leave the Knicks.

Swear to god this man was in my DMs saying this exact stuff about Jeremy Lin when he left",which are conveniently getting out now,2019-09-28 02:43:13
7,"Scottie Pippen: ""Porzingis don't really have a resume as a shot blocker."" ...Porzingis was#2 BLK/G, #1 BLK% in 2017-18",3278,d6gnvj,https://youtu.be/ZHciECvkZmI?t=57,441,1568940061.0,,"it would be terrible for reputation and ratings but would love to hear some legit ""shit I dunno"" on tv.

""Scottie how's KP at shot blocking?""

""shit I dunno. who watched Knicks games?""","These guys are just spitballing, it's the offseason they barely got any idea what they're saying before it comes out of their mouth",2019-09-20 03:41:01
8,"Kristaps Porzingis reaction to RJ Barrett naming him as the player he’d most like to posterize: “That’s fine. I’m a shot-blocker, despite what some people are saying. I’m one of the best shot-blockers in the league and I’m always up for the challenge.”",1728,dcx1sb,https://www.reddit.com/r/nba/comments/dcx1sb/kristaps_porzingis_reaction_to_rj_barrett_naming/,258,1570164889.0,"Kristaps Porzingis’s reaction to RJ Barrett naming him as the player he’d most like to posterize: “That’s fine. I’m a shot-blocker, despite what some people are saying. I’m one of the best shot-blockers in the league and I’m always up for the challenge. I think that’s a pretty good goal for him to try and dunk on me. That would be cool. I respect that.”

Sounds like he’s not too worried about RJ Barrett this year.

[Source from Dallas Reporter  Brad Townsend](https://twitter.com/townbrad/status/1179821186664013825?s=21)",Perfect response from kp,Shots at Scottie Pippen for saying he doesn't have a rep as a shot blocker?,2019-10-04 07:54:49
9,Boban and Porzingis takes a picture with JJ Barea,1584,dc36to,https://streamable.com/t2ki7,196,1570007801.0,,I joined the Mavs in 2k20 and unknowingly created the first all-white starting 5 that the league has probably seen in quite some time.,5'11 vs 6,2019-10-02 12:16:41
10,[Highlight] Drago Porzingis looking good from deep.,863,dfp8c3,https://streamable.com/45k23,157,1570691931.0,,"**Replays/alternate angles**

*I am a bot, and this action was performed automatically. Please [contact the moderators of this subreddit](/message/compose/?to=/r/nba) if you have any questions or concerns.*",he made his first 2 deep threes and another jumper,2019-10-10 10:18:51
11,Why is nobody talking about the fact that Kristaps Porzingis is 7'4?,892,dc45dd,https://www.reddit.com/r/nba/comments/dc45dd/why_is_nobody_talking_about_the_fact_that/,252,1570012567.0,Is that not insane to anyone else? [The Mavs measured him](https://www.dallasnews.com/sports/mavericks/2019/09/30/mavericks-tales-of-the-tape-j-j-barea-no-longer-a-6-footer-porzingis-comes-in-just-shorter-than-boban/) at 7'2 and 3/4 without shoes yesterday. This means he is 7'4 in game. That is absurd.,"Because it isn't that much more absurd than when he was still listed at 7'3"".",I'm not talking about it because I'm at work allegedly producing a powerpoint presentation and that would not be received well.,2019-10-02 13:36:07
12,"[Begley] RJ Barrett, in a Bleacher Report AMA, is asked who he’d like to posterize right now: “I know who I really wanna say but I’m not gonna. Let’s go with Porzingis.”",2356,d59367,https://twitter.com/IanBegley/status/1173747407986876417?s=19,254,1568707875.0,,"Maybe he just really hates someone random and he would feel stupid being like ""yeah I really wanna posterize Kyle Anderson, fuck that guy""","Ay y'all think he's talking about me? 

Cause I'm getting pretty heated rn",2019-09-17 11:11:15
13,I understand that they're for ratings & shock reactions but how does Kristaps Porzingis go from #59 to #34 without playing for a entire year?,987,d8tqww,https://www.reddit.com/r/nba/comments/d8tqww/i_understand_that_theyre_for_ratings_shock/,223,1569389294.0,"I really wish that they did these lists based on actual ability & improvement.

It really seems like basketball is just heading towards shock value & reality TV esque drama that ppl eat up & it's a shame to no end.

Edit: 

Zion is above DeMar fucking DeRozan WOW","Zion hype is crazy.  

Even David Griffin has been trying to tell fans they should expect him to be a Draymond Green type of player this year (not as good) but a high energy guy that scores from close and defends.

I think Porzingis hype is growing just because he’s had no set backs and he was an All-Star in NY without much around him.","The 59 ranking is considering that he was injured, now that he's fully recovered he went up",2019-09-25 08:28:14
14,[Highlight] Kristaps Porzingis crosses over Andre Drummond and hits the jumper,699,dfqi0x,https://streamable.com/eidtt,66,1570697997.0,,"**Replays/alternate angles**

*I am a bot, and this action was performed automatically. Please [contact the moderators of this subreddit](/message/compose/?to=/r/nba) if you have any questions or concerns.*",Hes fking 7' 3...,2019-10-10 11:59:57
15,Kristaps Porzingis responds to RJ Barrett saying he wants to posterize him. Knicks-Mavs play on Nov. 8 🍿,415,dcyilv,https://streamable.com/u2rdl,107,1570171285.0,,I bet you RJ really wants to dunk on Zion but he said KP to get Knicks fans excited about him lol,He looks jacked,2019-10-04 09:41:25
16,"[Townsend] Porzingis is not playing tonight, due to back-to-back, Carlisle says. Will play Wednesday in Detroit.",149,df2y5d,https://twitter.com/townbrad/status/1181616051802513410?s=21,73,1570583337.0,,Why are there B2Bs in preseason?,"Fuck yeah, I got free tickets to Wednesdays game, glad I'll get to see Porzingis play.",2019-10-09 04:08:57
17,"The last time Kristaps Porzingis played in an NBA game, Kawhi Leonard was on the Spurs, Blake Griffin was on the Clippers, and Lebron James was on the Cavs.",6549,cpue73,https://www.reddit.com/r/nba/comments/cpue73/the_last_time_kristaps_porzingis_played_in_an_nba/,324,1565737555.0,"Also, back when KP played his most recent game:

Jimmy Butler was on the Twolves, Tobias Harris was on the Pistons, Demarcus Cousins was on the Pelicans, Demar Derozan was on the Raptors, and Luka Doncic was on Real Madrid.

KP last played in an NBA game on February 6th, 2018. Porzingis hasn't played in 18 months and it'll be over 20 months by the time the season starts.

[Source](https://www.basketball-reference.com/players/p/porzikr01.html)","When the KP trade happened my friend reminded me I was at his last game as a knick. His last play was a dunk over Giannis; crowd goes wild then quiet as he grabs his knee. smh

&#x200B;

bonus play! It was also the same game where Giannis jumped over THJ to complete the alley-oop.  The Garden crowd was dumbfounded and couldn't quite believe what we just saw.",Did Luka play with Ronaldo?,2019-08-14 02:05:55
18,[McMahon]:All indications are that Luka Doncic will join Kristaps Porzingis in sitting out tonight in Tulsa. They’ll play tomorrow in Detroit. Not sure why the Mavs have a back-to-back scheduled in the preseason.,391,df7yno,https://twitter.com/espn_macmahon/status/1181705437634281479,28,1570604495.0,,I'm beginning to believe I will never get to see Doncic and Porzingis play together.,Probably because preseason games are largely useless and they don’t care if Luka and KP don’t play in all of them,2019-10-09 10:01:35
19,[Highlight] Luka Oop to Porzingis for the tough finish and one!,317,dfqefx,https://streamable.com/c9k1a,39,1570697515.0,,"**Replays/alternate angles**

*I am a bot, and this action was performed automatically. Please [contact the moderators of this subreddit](/message/compose/?to=/r/nba) if you have any questions or concerns.*",They gonna be a problem,2019-10-10 11:51:55
20,"[Price] With Doncic and Porzingis aboard, Nash believes it’s “a super exciting time to be a Mavericks fan”",472,d63dhv,https://www.mavs.com/with-doncic-and-porzingis-aboard-nash-believes-its-a-super-exciting-time-to-be-a-mavericks-fan/,151,1568865997.0,,He right,"Mavericks quietly pulled off an A+ rebuild without ever taking a hint of crap for it, and doing right by their aging superstar icon.",2019-09-19 07:06:37
21,Kristaps Porzingis vs. Luka Doncic 3-Point Shootout (FIRST LOOK AT KP & LUKA AT MAVS CAMP),144,dciorg,https://youtu.be/KZTlXjm9j9M,56,1570088506.0,,KP looking jacked,I forgot how quick KP's shot is. Especially considering he's 8 ft tall,2019-10-03 10:41:46
22,[Highlight] Porzingis drains a three on Giannis,111,dgo3ko,https://streamable.com/c68bp,36,1570870505.0,,"**Replays/alternate angles**

*I am a bot, and this action was performed automatically. Please [contact the moderators of this subreddit](/message/compose/?to=/r/nba) if you have any questions or concerns.*",Reminder that Porzingis' last play in an NBA game was a poster dunk on Giannis.,2019-10-12 11:55:05
23,[OC] A Genuine Unicorn: Finding a historical comp for Kristaps Porzingis,40,dgi66a,https://www.reddit.com/r/nba/comments/dgi66a/oc_a_genuine_unicorn_finding_a_historical_comp/,48,1570842710.0,"When Kristaps Porzingis was drafted, he received the title of ""unicorn:"" a mythical player who can protect the rim like a traditional towering big, and shoot 3s like a wing. KP has, amazingly, fully lived up to that moniker, posting one of the highest block rates in the league in 2018 while shooting 3s at over 40%. However, the rest of his game is hugely questionable: he was one of the least efficient volume scorer in the league, posted a historical low assist rate for a volume scorer, and was a very poor rebounder. In order to try and project his career ceiling, I looked for other young players with similar profiles to see where their career ended up.

I first messed around for a while on BBall Ref trying to find other players who put up high scoring rates, collected very few assists, and weren't very efficient. [My first criteria came up with just KP, and 26 year old John Drew](http://bkref.com/tiny/Bqfm4). Loosening it slightly came up with [more John Drew, an old Moses, and some other good but not great players](http://bkref.com/tiny/Bqfm4). Compared to league average TS%, KP is actually at the bottom of this group in efficiency. Loosening the volume scoring criteria [lumps Porzingis with some very good and very bad players](http://bkref.com/tiny/hZtp1), and it becomes clear that this approach isn't gonna be all that revelatory.

I then went for an approach that better reflected his overall two-way game. I found three clubs that seemed fitting for KP:

[Players age 23 and under, 25+ pts/100, 2.5+ blk/100, <2.5 AST/100](http://bkref.com/tiny/oJ6xf)

This captures all 3 of Porzingis's seasons, and lumps him in with a varied group of players. We see him grouped with future superstars like Shaq and Hakeem, a comparable young player in Jaren Jackson Jr, and some solid players like Big Z and McDyess. The only issue is that even within this group, KP is an outlier: his most scoring rate is the highest on the list by far, and he's dead at the bottom of the heap with McDyess in relative TS%. His assist/usage ratio is also the worst of all these players.

[All players, 30+ pts/100, 2.5+ blk/100, <2.5 ast/100](http://bkref.com/tiny/aQfEv)

I removed the age filter in order to find more big volume scoring seasons like Kristaps' 17-18. Here, KPnis grouped exclusively with HoFers and a young Brook Lopez, but he's radically less efficient than the entire rest of the list. His supporting cast was also probably the worst, but Lopez and Davis both also had very rough supporting casts.

[Players age 23 and under, >25% usage, 2.5+ blk/100, <2.5 ast/100](http://bkref.com/tiny/ktmwr)

The group narrows to just Porzingis, McDyess, and HoFers. This reflects the same pattern as before: KP is radically less efficient than other young bigs with high usage, serious defensive talent, and very limited passing.

The reason I keep pinpointing on Porzingis' efficiency is that I don't think it's something that'll just change overnight on a good team. Porzingis shot fantastically from 3 and posted a fairly high free throw rate in 2018. If his shooting regresses and/or his reduced role in Dallas doesn't allow him to draw as many fouls, the efficiency gains he makes from other areas improving could be largely erased. I don't doubt that he'll probably get to above average efficiency as he improves, but I don't think he's ever going to really efficient without taking far less shots.

Overall, Porzingis is a complete outlier, both for better and for worse. I think looking through past comparisons gives a lot of clarity as to what he *isn't*, but does less to illuminate what he *is*. 

The comparison that strikes me most is actually a guy that didn't show up in these comps: **Rasheed Wallace**. Like Porzingis, Wallace was a stretch big with excellent defense, but had limitations that put a ceiling on his offensive impact. Wallace never put up the same scoring rates KP has, but he was more efficient and better as a passer. I think like Wallace, KP can peak as a top 11-15 player in the league, but it's unlikely he'll ever be a franchise player type guy. 

**TLDR:** Kristaps Porzingis is much better on defense than other inefficient young volume scorers, but much less efficient than other young volume scoring defensive bigs. He's also really fucking bad at passing. IMO he will probably peak as an All-NBA level guy, but not a franchise player.","yall want KP to be steve nash now? 

""he will peak as an all nba level guy"" he said this like it was a diss","KP went from being a bit underrated as a Knick to overrated when he left. Even if you disregard the health issues he has some very major flaws in his game. His efficiency in the second half of the season has been abysmal every year of his career, and he's a god awful passer. His rim protection and 3 point shooting is special though. In addition to actually being healthy he has to improve *a lot* to be worth that max contract. Agree that his peak is probably all-NBA but not the best player on a legitimate contender.",2019-10-12 04:11:50
24,[Highlight] Khris Middleton gets a steal and collapses Porzingis with the behind the back pass to Giannis who slams it home,148,dgowlt,https://streamable.com/rf4x6,28,1570874864.0,,"**Replays/alternate angles**

*I am a bot, and this action was performed automatically. Please [contact the moderators of this subreddit](/message/compose/?to=/r/nba) if you have any questions or concerns.*","bro you can't use KP and collapse in the same sentence man. you almost scared me


edit: just saw the video. nevermind.",2019-10-12 13:07:44
25,Kristaps Porzingis Dallas Mavericks DEBUT Full Play 1st Half 2019.10.09 vs Pistons | FreeDawkins,55,dfpy2c,https://youtu.be/RAcGSZZiMMk,38,1570695387.0,,You people are so damn fast,Damn this dude gets 1st half highlights during preseason lol,2019-10-10 11:16:27
26,"[Charania] Sources: Dallas Mavericks All-Star Kristaps Porzingis makes his return to New York on Nov. 14 to play the Knicks at Madison Square Garden. Porzingis signed a new five-year, $158M maximum deal with Dallas this summer.",1582,cl927a,http://twitter.com/ShamsCharania/status/1157379711183589376,378,1564804601.0,,He's gonna get booed so hard lmao,Might be the loudest boos ever heard in an NBA arena,2019-08-03 06:56:41
27,Kristaps Porzingis vs. Luka Doncic 3-Point Shootout ROUND TWO from Dallas Mavs Camp,91,ddwn9i,https://www.youtube.com/watch?v=NyLsrPzdLiU,32,1570353965.0,,KP why you break my heart bby,Staps lookin jacked,2019-10-06 12:26:05
28,Mavericks' Kristaps Porzingis after bulking up in offseason: 'I feel probably better than I ever have in my life',92,dbm4w9,https://www.cbssports.com/nba/news/mavericks-kristaps-porzingis-after-bulking-up-in-offseason-i-feel-probably-better-than-i-ever-have-in-my-life/,37,1569923329.0,,Dude looks jacked,Ate some rats this off season.,2019-10-01 12:48:49
29,"Porzingis swats Josh Jackson on one end, then throws it down on the other",293,d117mi,https://streamable.com/3f1vf,64,1567917021.0,,Great now i'm depressed again,https://media.giphy.com/media/oxTYQeTb6F286IbY4r/giphy.gif,2019-09-08 07:30:21
30,"Luka Doncic and Kristaps Porzingis playing against each other in the quarter-finals of the Eurobasket 2017. Luka finished with 27 points, KP with 34.",687,cm7x0q,https://www.youtube.com/watch?v=wM18FAGrdbk,158,1565019205.0,,"I was at the stadium that day, the other game was Spain-Germany. After the game I knew that I witnessed one hell of a thing. Since I am not from US, I don't have so many chances to see Nba stars but I saw Gasol brothers, Schröder, Porzingis, Dragic and Doncic at the same day. One of the best days for me.",Insane that he was putting up those numbers against that competition at that age what the fuck. It still blows me away.,2019-08-05 18:33:25
31,"[Charania] Sources: Dallas Mavericks star Kristaps Porzingis‘ five-year, $158M maximum contract gives him a player option in the final season in 2023.",2037,cce6kd,http://twitter.com/ShamsCharania/status/1149738241190330368,387,1562982734.0,,Cha-chingis,This is a very player friendly deal,2019-07-13 04:52:14
32,Porzingis posted on his IG story that the truth of him wanting out of New York will come out soon. Where is it?,206,cyvsep,https://www.reddit.com/r/nba/comments/cyvsep/porzingis_posted_on_his_ig_story_that_the_truth/,70,1567490613.0,We haven't really heard him say anything about his departure from the Knicks and what led to it. All we know is his brother wanted a role and was told no. When is Porzingis going to address this? It's been 7 months now,"If he looks good at the start of the season, trust me NY media is gonna write dozens stories about how NY fucked up and we should've kept him at all costs.","The theory among some of us is that ""the truth"" here is related to the Spurs/Knicks spat around Marcus Morris earlier this offseason. The Knicks say that the Spurs had illegal contact with Porzingis. The timeline for this is before the Mavs-Knicks trade and before Porzingis' trade request. Some people think - take it for what you will - that Porzingis found out he was being shopped via San Antonio. Or, San Antonio leaked some info to him that exacerbated his perception of the Knicks' dysfunction. Also bear in mind that Phil Jackson had previously publicly said he was listening to trade offers on KP, anyway.",2019-09-03 09:03:33
33,"[Stein] The Mavericks and Kristaps Porzingis have reached agreement on a new five-year, $158 million contract, league sources say",5225,c7k7oq,https://www.twitter.com/TheSteinLine/status/1145452094163496960,282,1561960844.0,,well yeah,Triple Dirks,2019-07-01 09:00:44
34,"Zach Lowe speaking on the Porzingis trade with Ian Begley: ""I don’t think he was psyched about playing with Durant.""",9,dcx2qh,https://www.reddit.com/r/nba/comments/atn880/zach_lowe_speaking_on_the_porzingis_trade_with/,40,1570165002.0,,You’re reposting this 200 days later? Why?,I don’t think anyone in media right now has a good view on the Knicks. Full of half truths with blatant misinformation and biases.,2019-10-04 07:56:42
35,Can Porzingis return back to his top level after long-term injury?,18,d8zkm1,https://www.reddit.com/r/nba/comments/d8zkm1/can_porzingis_return_back_to_his_top_level_after/,41,1569422696.0,"There’s a lot to look forward to as an NBA fan in the upcoming season but one of the most anticipated is undoubtedly the return of Kristaps Porzingis.The 7-foot-3 forward missing a combined total of 132 games across the last three seasons, including the entire 2018-19.

https://i.redd.it/gd115bb9soo31.jpg","Forzingis

He will be just fine if he can stay healthy.","I feel like ACLs and Achilles injuries aren’t what they used to be, doctors are really good at fixing them back up in 2019. Most players will come back at a similar level they played at when they got hurt. 

I’ve noticed ACL injuries being less likely to be that detrimental when Adrian Peterson tore his ACL in like 2012 and then came back and led the league in rushing the next year. Sure AP is a freak of nature athlete, but shit most star athletes are now a days",2019-09-25 17:44:56
