,title,score,id,url,comms_num,created,body,topcomment,comment2,date
71,Can we now say the Knicks lost the Porzingis trade?,69,c7jmxr,https://www.reddit.com/r/nba/comments/c7jmxr/can_we_now_say_the_knicks_lost_the_porzingis_trade/,87,1561957873.0,"Now that KD and Kyrie are both off the table, and with next year's FA class being nowhere near what this year's was, can we now definitively say they lost the trade?",Yeees,"Porizingis wanted out, they got cap space and picks, I'd say it was pretty neutral",2019-07-01 08:11:13
72,"[Berman] Players Association with statement supporting Kristaps Porzingis: ""We have been aware of these allegations for some time, have evaluated the accuser's claims and, based what is presently before us, stand with Kristaps.""",2437,b7uavl,https://twitter.com/NYPost_Berman/status/1112495219474382849,516,1554103750.0,,Can't wait for this to be over regardless of the result ,Damn. I think this is a pretty strong stance. NBPA has their own lawyers and I am 100% sure they reviewed everything and came to this conclusion. We just have to wait and see though ,2019-04-01 10:29:10
73,What was the result of the Kristaps Porzingis legal case?,2,d2i58i,https://www.reddit.com/r/nba/comments/d2i58i/what_was_the_result_of_the_kristaps_porzingis/,8,1568193417.0,"With the Antonio Brown news breaking right now, I just remember that KP had a case against him many months ago. I don’t remember hearing anything about the case since then. Do any of you guys know the result of that case?","The girl faked KP's signature on some paper which said KP will give her little brother college tuition of around 60k$. Had been sending KP her nudes weeks after the so called ""rape"". Went to police only after KP alarmed the league about an extortion attempt. Everything just went cold after this.",It's still going on. They're probs still in discovery.,2019-09-11 12:16:57
74,"[Townsend] Despite unconfirmed reports out of Latvia that Kristaps Porzingis broke his hand, a high-ranking Mavs official tells me, that's ""not what he's telling us.""",674,bombaz,https://twitter.com/townbrad/status/1128331325080068100,137,1557885838.0,,The KP saga is crazy,This dude should have been a Sixer with this crazy shit.  Wouldnt' even faze us,2019-05-15 05:03:58
75,"Kristaps Porzingis Full Highlights vs Lakers - 37 Pts, 11 Rebs, 5 Blks, 2 GOOD!",24,clahvt,https://www.youtube.com/watch?v=Bl9nFxyXkHQ&t=84s,22,1564811512.0,,"Can’t wait to see him and Luka 2 man game, gonna be fun as hell.",#DECENT!,2019-08-03 08:51:52
76,Action Bronson on Kristaps Porzingis and New York,6,cnujwd,https://streamable.com/hf1pf?utm_source=share&utm_medium=ios_app,21,1565339039.0,,"**Replays/alternate angles**

*I am a bot, and this action was performed automatically. Please [contact the moderators of this subreddit](/message/compose/?to=/r/nba) if you have any questions or concerns.*",Y’all see this rain that came outta nowhere,2019-08-09 11:23:59
77,"[Discussion] So if the Knicks traded Kristaps Porzingis and their assets to clear cap space for KD and Kyrie, why do they do now with all that cap space?",33,c7jm5w,https://www.reddit.com/r/nba/comments/c7jm5w/discussion_so_if_the_knicks_traded_kristaps/,70,1561957766.0,"[Discussion] So if the Knicks traded Kristaps Porzingis and their assets to clear cap space for KD and Kyrie, why do they do now with all that cap space?",Use it to absorb bad contracts for picks.,Sign veterans/low risk players to short term deals,2019-07-01 08:09:26
78,Is Porzingis going to get booed when the Mavericks visit MSG?,11,celolp,https://www.reddit.com/r/nba/comments/celolp/is_porzingis_going_to_get_booed_when_the/,38,1563440772.0,"Since there are conflicting reports about the reason for the Porzingis trade, I’m not sure to what degree Knicks fans hate Porzingis. He requested the trade, but then also claimed that there was more that would come to light and told fans to “stay woke” (corny ass). So basically, he thought the front office was bad and told Knicks fans to think about that. 

So which is the case?

1. Knicks fans agree with Porzingis and understand why he would want to leave, therefore they will not boo him. 

2. Knicks fans agree with Porzingis and understand why he wants to leave, but they will still boo him anyways.

3. Knicks fans disagree with Porzingis, but don’t boo him because they still appreciate him. 

4. Knicks fans disagree with Porzingis and boo the shit out of him.",They’re gonna boo,Was the horde of snake emojis not enough to explain it to you?,2019-07-18 12:06:12
79,"[Chandler] Attorney for Kristaps Porzingis tells me Kristaps denies there was any sex that was non-consensual. Additionally, made the Knicks and NBA officials aware before reporting the accuser to NYPD for extortion in December.",1288,b7ih7b,https://twitter.com/JohnChandlerNBC/status/1112163298751975425?s=19,496,1554024633.0,,"https://twitter.com/mikejbabcock/status/1112160828793352192

RE: Porzingis, law enforcement sources tell us the alleged victim told cops Kristaps pinned her down & penetrated her w/ his penis on a bed in his guest room. She claims KP then hit her several times, & called her “my bitch” & “my slave.”",Kristaps denied it? Wtf I thought he’d own up to it that’s crazy,2019-03-31 12:30:33
80,"[MacMahon] uka Doncic’s response when Dirk tries to regale him with tales from the Mavs’ title run: “You’re so old.” But Kristaps Porzingis peppers Dirk with questions. “Porzingis shows a little more respect towards me than Luka does,” Dirk says with a smile.",2608,b6l1od,https://streamable.com/7ncsi,275,1553819873.0,,"**Replays/alternate angles**
                        


*I am a bot, and this action was performed automatically. Please [contact the moderators of this subreddit](/message/compose/?to=/r/nba) if you have any questions or concerns.*",The future is now old man ,2019-03-29 02:37:53
81,"[Cooperstein] You may have missed @mcuban visit to @siriusxmNBA. Some very interesting things here, not the least of which is that Porzingis is going to be load managed.",34,cbyfpo,https://twitter.com/coopmavs/status/1149364783541624836,34,1562894669.0,,"Uh oh, you just said /r/nba's favorite word.",Duh it's the smartest move.,2019-07-12 04:24:29
82,[MacMahon] Sources: Mavs have extended qualifying offers to Maxi Kleber and Dorian Finney-Smith to make them restricted free agents. Dallas views Kleber and Finney-Smith as quality role players who fit well with their Luka Doncic-Kristaps Porzingis core.,170,c5tnxf,https://twitter.com/espn_macmahon/status/1143950898965680133?s=19,36,1561602945.0,,stay away from our triple Dirks,Triple Dirks!,2019-06-27 05:35:45
83,"Grandma of Porzingis confirms, that initial plan for Kristaps was to sign contract with Mavericks for one year only",55,cdk6ay,https://jauns.lv/raksts/sports/339920-foto-par-kristapa-miljoniem-pie-juras-top-porzingciems-vislabakie-meistari-buve-pilna-spara,26,1563239309.0,,Nana Porzingis don’t care about financial security,"Thank you for your input, Granny Tingus Pingus.",2019-07-16 04:08:29
84,"7 Players signed the Largest contracts in their teams history today (Portland-Dame, Sixers-Tobias, Bucks-Middleton, Nets-KD, Mavs-Porzingis, Celtics-Kemba, Miami-Butler)",81,c7pyan,https://imgur.com/a/PS9sl4o,32,1561997758.0,,Bag: secured.,"In other news, I got a 30¢ raise today guys",2019-07-01 19:15:58
85,"[Stein] The Knicks, of course, hung onto DeAndre Jordan after acquiring him from Dallas in the Porzingis blockbuster in February and have shown interest in re-signing Jordan depending on how the roster shakes out -- interest that naturally rises if Durant chooses Madison Square Garden.",81,c4stp8,https://twitter.com/thesteinline/status/1143221900157603840?s=21,38,1561429135.0,,"I would love Deandre back, he and Mitchell got really close and we attribute Mitchell's rise because he had a mentor like DAJ","No, DJ is not a star anymore. Yes, he is still very valuable. 

He's fine on the court, not hurting the team, but off the court is where his value really presents itself. Look at Mitchell Robinson's growth pre and post Tim Hardaway Jr. trade. DJ did so much work with Mitch, even Mitch and Fizz give him a lot of credit. 

If we land KD but strike out on everything else, I don't hate the idea of giving DJ a one year good faith contract similar to what Redick got in Philly.",2019-06-25 05:18:55
86,"[Townsend] League sources strongly contradict Porzingis report: Knicks told Mavericks of 'extortion,' but never used word 'rape'",2410,b7s8fe,https://twitter.com/townbrad/status/1112446185527279621,307,1554092413.0,,I find it hard to believe the Knicks told Dallas KP was being extorted and Dallas didn’t ask forthe reason why. ,I'm just here for overreactions,2019-04-01 07:20:13
87,[Charania] Sources: All-Star Kristaps Porzingis is planning to inform the Dallas Mavericks his intent is to sign the qualifying offer in restricted free agency this summer.,3772,alu99v,https://twitter.com/ShamsCharania/status/1091080742749253632,1176,1548997707.0,,Don't tell me Dallas actually fucked up,Wait WHAT,2019-02-01 07:08:27
88,"When Porzingis and Marjanovic take the floor for the Mavs, they will become just the sixth pair of 7'3' or taller teammates in NBA history.",133,c8tl23,https://www.reddit.com/r/nba/comments/c8tl23/when_porzingis_and_marjanovic_take_the_floor_for/,22,1562216464.0,"The Mavs had another set in 2004-2005 (Bradley, Podkolzin). Via @mavstats on Twitter. 

Mavs will likely not re-sign Mejri, but if they do, Dallas will have the NBA’s three tallest players from the 2018-19 season on their roster.","> Mavs will likely not re-sign Mejri

He's a better threat from 3 than Ben Simmons is, let that sink in","The other four pairs, by my quick research:

Manute Bol and Ralph Sampson (Warriors, 88-89)

Manute Bol and Shawn Bradley (76ers, 93-94)

Manute Bol and Gheorghe Muresan (Bullets, 94)

Chuck Nevitt and Ralph Sampson (Rockets, 83)",2019-07-04 08:01:04
89,"[Charania] New York and Dallas are in deep discussions on a trade that would send Kristaps Porzingis to the Mavericks and Dennis Smith Jr. to the Knicks, league sources tell @TheAthleticNBA @WatchStadium.",3990,altx1i,https://www.twitter.com/ShamsCharania/status/1091072994384973826,915,1548995860.0,,"News about KP Trade:

[[Stein] The Knicks would receive Dennis Smith Jr. and the expiring contracts of DeAndre Jordan and Wes Matthews in the proposed trade, according to league sources](https://twitter.com/TheSteinLine/status/1091073144851480576)

[[Stein] The Mavericks have agreed to take on the contracts of Tim Hardaway Jr. and Courtney Lee to faciliate a Porzingis trade and are working to complete the transaction today, league sources say](https://twitter.com/TheSteinLine/status/1091073004988235776)

[[Stein] The Knicks would also receive future first-round draft compensation from the Mavericks and, by shedding the contracts of Hardaway and Lee, create the salary-cap space this summer to pursue two maximum contract free agents](https://twitter.com/TheSteinLine/status/1091073212887244801?s=19)

[[Stein] The Knicks would also receive future first-round draft compensation from the Mavericks and, by shedding the contracts of Hardaway and Lee, create the salary-cap space this summer to pursue two maximum contract free agents](https://twitter.com/TheSteinLine/status/1091073212887244801?s=19)

[[Charania] Sources: New York and Dallas have agreed in principle on a trade sending package around Kristaps Porzingis for Dennis Smith Jr. Wes Matthews, other contracts, and picks going to New York, and Tim Hardaway Jr., Trey Burke among players going to Dallas. Sides finishing final terms.](https://twitter.com/ShamsCharania/status/1091076348087619585)

[[Charania] Sources: All-Star Kristaps Porzingis is planning to inform the Dallas Mavericks his intent is to sign the qualifying offer in restricted free agency this summer.](https://twitter.com/ShamsCharania/status/1091080742749253632)

Current Trade Situation:

Knicks trade: Kristap Porzingis + Courtney Lee + Tim Hardaway Jr. + Trey Burke

Dallas trade: Dennis Smith Jr + Wesley Matthews + DeAndre Jordan + future 1st round draft compensation

Kristaps going to sign the Qualifying Offer.",KILL ME,2019-02-01 06:37:40
90,"[MacMahon] “Porzingis, who will be a restricted free agent the Mavs plan to sign to a five-year, $158 million maximum contract this summer,”",1342,b5uxuw,http://www.espn.com/nba/story/_/id/26350776/patient-porzingis-sitting-very-very-tough,322,1553661514.0,,Thats risky but sometimes you gotta do what you gotta do,"People talk bout him turning this down, if he turns this down I wouldn't even be mad. You would have to be mentally unstable to turn that down. ",2019-03-27 06:38:34
91,What happened to Porzingis rape case?,6,c8et7s,https://www.reddit.com/r/nba/comments/c8et7s/what_happened_to_porzingis_rape_case/,106,1562129216.0,"Porzingis was accused of rape just 2 months ago. What happened to it? Did everyone already forgot?

Seems like his marketing team did a great job because no one talks about it anymore",He just got sentenced to prison sadly,He used Apple Pay and its a done deal,2019-07-03 07:46:56
92,[Report] Knicks believe Spurs tampered with Kristaps Porzingis,1,cifrw1,https://nba.nbcsports.com/2019/07/26/report-knicks-believe-spurs-tampered-with-kristaps-porzingis/,35,1564250630.0,,Knicks don’t even remember where they traded their players to,What kind of tampering? Tampering like they did with KD and Kyrie? Or like quazi tampering like they did Marcus Morris?,2019-07-27 21:03:50
93,"[Porzingis] ""The truth will come out :)""",3587,aly7bd,https://www.reddit.com/r/nba/comments/aly7bd/porzingis_the_truth_will_come_out/,881,1549023445.0,"KP just posted on his Instagram story a simple caption.  [""The truth will come out :)""](https://pbs.twimg.com/media/DySteE6UwAEP6dM.jpg)  There's seemingly more to the story that hasn't been revealed yet.","dolan: im trading u and im gonna say u asked for a trade

porzingis: fuck you

dolan: good talk
",Give. Me. Drama.,2019-02-01 14:17:25
94,"[Stein] Dallas has made it clear since the season ended that re-signing Dwight Powell to an extension was among its highest off-season priorities along with securing Kristaps Porzingis' commitment on a five-year, $158 million deal that will also happen formally later tonight",103,c7fjum,https://twitter.com/TheSteinLine/status/1145348921696444418?s=19,24,1561936271.0,,Dallas trading for KP was great. Hope the dude can stay healthy,"Dwight is a bit one dimensional but after looking into his advanced numbers I actually good with it. 

He can play PF, with KP at the C on defense. 

Surprisingly, Powell is actually a amazing perimeter defender. And he is a incredible roll man. Check out his rankings:

Skill | Mark
---|---
Perimeter Shot | C-
Off-Ball Movement | B+
One on One | C-
Finishing | A
Roll Gravity  | A
Playmaking | C
Post Play | A- 	
OReb | A-
Perimeter Defense | A-
Interior Defense | C+
DReb | A-

Given that KP can protect the rim and Pick and Pop, and he can play the perimeter and be the perfect PnR partner with Luka. I do think it makes sense to put him in the starting lineup.

Edit:

Some more:

BPM: 2.7

PIPM: 2.4

Those are all solid numbers.",2019-07-01 02:11:11
95,"Knicks were actually net positive with Porzingis on the court in 2018, and went 22-26 with him and 7-27 without",25,ceniq7,https://www.reddit.com/r/nba/comments/ceniq7/knicks_were_actually_net_positive_with_porzingis/,21,1563451425.0,"Only him and Ron Baker had positive OnCourt numbers that year, and OnOff too.

https://www.basketball-reference.com/teams/NYK/2018.html#all_pbp

They went 22-26 with Porzingis in the line-up and 7-27 without him.",Not really that surprising for people with memory that can last longer than a singular year.  Ron Baker was playing like an MVP candidate.,Wow it's like he was playing like an all-star or something,2019-07-18 15:03:45
96,Carmelo Anthony and Porzingis became good friends in New York. What about a reunion and Mavs sign Melo to lead their bench? The bench in Dallas is hella weak and could use a Vet Scorer like Melo,0,clyuhp,https://www.reddit.com/r/nba/comments/clyuhp/carmelo_anthony_and_porzingis_became_good_friends/,38,1564967863.0,"If the Mavs want to make the playoffs in the loaded West, why not sign Anthony to give them a real chance?

He and KP were fond of each other (unlike the Melo/Lin disaster) and their personalities clicked. I think Melo makes sense on a contender and if you add him as a bench option, hell if he plays well maybe even becomes the third scoring option...the Mavs could be spooky

I mean imagine if Luka/KP/Melo as a low seed went off in round 1 and upset the Clippers, Rockets or Lakers. 
How juicy would that story be?


Melo gets revenge. Luka shows the world his ability, KP is legit. Mavs would be talk of the league.","Our bench is not hella weak, our starters (sans Porzingis and Luka) are what set us apart from the top West teams",i'd love that but i think melo wants to be on a surefire title contender,2019-08-05 04:17:43
97,"Kristaps Porzingis UNREAL Career-HiGH 40 Pts 2017.11.05 vs Pacers - 40 Pts, 6 Blks, CLUTCH MVP Mode!",15,cay9xh,https://www.youtube.com/watch?v=7rC88CXX0n0,30,1562691121.0,,Luka and KP will be so great to watch next season,Luka KP 2 man game is gonna be so much fun,2019-07-09 19:52:01
98,Translation of Porzingis' voice message he sent after fight,518,bnuavj,https://www.reddit.com/r/nba/comments/bnuavj/translation_of_porzingis_voice_message_he_sent/,80,1557724620.0,"This was a Whatsapp voice message he sent that got leaked. It's floating around everywhere in Latvia. I can't upload the message here you just have to trust my word, it goes like this:

Edit: This is the audio file - https://www.delfi.lv/temp/audio/porzingis4.mp3

""Shit was messed up, some dudes started coming at me (he doesn't mention why) they punched me and then I started punching them back, then things settled down for a bit, two of my guys got knocked out straight away, those dudes were from some local gang, than this guy threw a chair at me and hit me in the head and caught one my guys as well, bunch of chairs were thrown, then I caught one them and got him real good, fucked him and his face up then someone pushed me off of him and as I was getting up one of them got me pretty good in the head and that's why my head was bleeding a bit but otherwise im fine. I fucked up my hand a bit, but I'll be good.""

Hope that cleared some things up, sorry for the mistakes and formatting im on mobile.",">then I caught one them and got him real good

Lol",He need new guys if 2 of them got knocked out from the start,2019-05-13 08:17:00
99,"Kevin Durant: ""I got nothing to do with the Knicks. I don't know who traded Porzingis. That got nothing to do with me. I'm trying to play basketball.""",3462,ao0w29,https://streamable.com/xydd7,656,1549549695.0,,"### **Replays/alternate angles**
                


*I am a bot, and this action was performed automatically. Please [contact the moderators of this subreddit](/message/compose/?to=/r/nba) if you have any questions or concerns.*",He called out Ethan Strauss by name,2019-02-07 16:28:15
100,"[Isola] Spurs who lost made it (The Morris deal) extra special for the Knicks, who privately suspected San Antonio, with deep ties in Europe, may have made illegal contact with Kristaps Porzingis while he was still with the Knicks.",4,cf8s68,https://theathletic.com/1085119/2019/07/19/isola-the-marcus-morris-situation-has-rekindled-fire-between-spurs-and-knicks/,31,1563578158.0,,/r/titlegore,That's some top level pettiness over a good not great roll player,2019-07-20 02:15:58
101,[Mannix] Some bewilderment coming from several teams who were shocked Porzingis was available. Becoming very clear the Knicks did little in the way of league-wide canvassing for offers before moving KP to Dallas.,2851,amj0zf,https://twitter.com/SIChrisMannix/status/1091820742143102976,619,1549174202.0,,"The only take away here is that James Dolan is a very smart, strong, handsome man with the voice of a thousand angels who *totally* knows what hes doing ",Either Mills and Perry were absolutely shocked they got that much and wanted to secure it as fast as possible or KP was that far out the door already.,2019-02-03 08:10:02
102,Woman wanted Knicks to 'mediate' with Porzingis,409,b81wi9,http://www.espn.com/nba/story/_/id/26414381/woman-wanted-knicks-mediate-porzingis,230,1554151615.0,,"Please keep all comments in line. All our normal rules apply to these threads, and bans will be handed out if necessary. If you notice any offending comments, please report. Thanks","“As a Knicks fan I don’t want him to get in trouble with the law”

Case dismissed, bring in the dancing lobsters ",2019-04-01 23:46:55
103,Who would you rather have: Kristaps Porzingis or Blake Griffin?,0,cgwjf1,https://www.reddit.com/r/nba/comments/cgwjf1/who_would_you_rather_have_kristaps_porzingis_or/,66,1563935793.0,"Assume both are healthy, in their prime at age 26, and are signing a 4 year deal with your team.",[removed],Blake. All fucking day.,2019-07-24 05:36:33
104,"[Wojnarowski] Reporting with @ZachLowe and @RamonaShelburne: In meeting with management today, Knicks forward Kristaps Porzingis expressed his concern with the losing, franchise direction and an uncertainty that a culture is developing that will enable sustainable organizational success.",3412,alspal,https://twitter.com/wojespn/status/1091044461663174656,796,1548989050.0,,Fuck.,How are we gonna help these small market teams hang onto their stars?,2019-02-01 04:44:10
105,People have forgotten just how good Kristaps Porzingis is,12,c1fysz,https://www.reddit.com/r/nba/comments/c1fysz/people_have_forgotten_just_how_good_kristaps/,81,1560753548.0,KP was an all star at age 22 putting up 23 PPG and 7 TRB while shooting nearly 40% from 3. He also averaged 2.4 BLK and is one of the best rim protectors in the game. KP is potentially a 25/10 guy with elite rim protection and that is a sniper from 3. He is a KAT/AD type player if he can stay healthy. Obviously the problem with KP is his ability to stay healthy but if he can he is a potential MVP player.,Seems like he hasn't played in forever,Well he hasn’t played for almost two years so he might be a bit rusty,2019-06-17 09:39:08
106,"[Charania] Sources: New York and Dallas have agreed in principle on a trade sending package around Kristaps Porzingis for Dennis Smith Jr. Wes Matthews, other contracts, and picks going to New York, and Tim Hardaway Jr., Trey Burke among players going to Dallas. Sides finishing final terms.",3090,alu2cr,https://www.twitter.com/ShamsCharania/status/1091076348087619585,640,1548996663.0,,That has to be the fastest trade after a demand in NBA history ,"First Luka, and now Porzingis. The Mavs have had a hell of a year.",2019-02-01 06:51:03
107,Can Luka Doncic and the Mavericks Bring Out The Best in Kristaps Porzingis? | FreeDawkins,12,cek790,https://www.youtube.com/watch?v=6UHXFQVuQ5E,20,1563432875.0,,Kristaps will bring out the best in the Mavs,"I like the Mavs but I’d be at least mildly concerned about the fact that he’s played 72, 65 and 48 games in his 3 years.",2019-07-18 09:54:35
108,What are people expecting from Porzingis?,5,c6minn,https://www.reddit.com/r/nba/comments/c6minn/what_are_people_expecting_from_porzingis/,68,1561769305.0,"So by the time next season starts it's going to be like 20 months since Kristaps Porzingis last played in an NBA game. What do fans expect him to perform like this year? Seems like he's a lock to get the max from the Mavs, does anyone think that's a big risk for Dallas?",He should probably put the ball through the hoop at least once next season,"I'm not expecting insane unicorn stuff, but I expect to at least see all star *potential*. If not, I will be a bit worried for him/them, because he should pretty easily be back to that",2019-06-29 03:48:25
109,"Mitchell Robinson’s 5 year market value of $181.9m is 34.5m more than Kristaps Porzingis’ $147.4m, per fivethirtyeights CARMELO",0,c942fs,https://imgur.com/gallery/sNKoVq8,70,1562283953.0,,That's the nature of advanced stats and minimal minutes. They get more reliably with a larger sample size. Mitchell Robinson had a BPM of 5.7 last year,"Prior to 2018, this system valued Jae Crowder as like worth 115m or something.",2019-07-05 02:45:53
110,"[MacMahon] Cuban:""Yes, he does (want to sign a long term deal)."" Porzingis:""We're on the same page""",2716,an5hre,https://twitter.com/espn_macmahon/status/1092509830898765824,347,1549338644.0,,Porzingis just confirmed he’s not playing for the rest of the season. Also said he has a great relationship with Luka since they were both young in Spain.,Happy Monday Mavs fans,2019-02-05 05:50:44
111,"[MacMahon] Kristaps Porzingis probably will not play for the Mavericks this season as he continues his recovery from a torn ACL in his left knee suffered a year ago, Dallas owner Mark Cuban told ESPN.",2509,am8bur,https://twitter.com/espn_macmahon/status/1091481846075084800,346,1549093375.0,,So now the Mavs are holding him out for the tank lmao,fuckin knicks holding him back from playing,2019-02-02 09:42:55
