,title,score,id,url,comms_num,created,body,topcomment,comment2,date
150,Remember the Porzingis vs Jokic debates?,22,blxunw,https://www.reddit.com/r/nba/comments/blxunw/remember_the_porzingis_vs_jokic_debates/,111,1557300292.0,"[https://i.imgur.com/CyyvIAW.png](https://i.imgur.com/CyyvIAW.png)

&#x200B;

Per 36 numbers from each of their first 3 years in the league. Jokic is a special passer but Porzingis had elite rim protection. 

&#x200B;

Both shot nearly 35% from 3s on similar attempts, about 80% from the FT line, and averaged similar PPG.

1 year later, Porzingis is injured and traded to the Mavericks, while Jokic leads his team to No2 seed in the west averaging  24.5 ppg, 12.5 r, 9.3 a, 1.5 s in the 2nd round so far.

&#x200B;

What would Porzingis have to do next year to make this even a close debate again??",Remember the Jokic vs Okafor debate?,I actually forgot Porzingis existed,2019-05-08 10:24:52
151,"After seeing Boogie and Hayward come back like bums, we should temper outright expectations for Oladipo and Porzingis next season",31,by3wbe,https://www.reddit.com/r/nba/comments/by3wbe/after_seeing_boogie_and_hayward_come_back_like/,20,1559995928.0,I get that all their injuries are different but they're all massive injuries and those are hard to return from. We can hope for the best but we shouldn't expect all star form,"Maybe, but ACL tears have a way better track record of recovery.

EDIT: I guess Dipo is ruptured quad tendon.  That'll be rough, especially for his game.","Porzingis will be hurt again by all star break, as is tradition",2019-06-08 15:12:08
152,The Knicks and the porzingis trade,0,c4vd3s,https://www.reddit.com/r/nba/comments/c4vd3s/the_knicks_and_the_porzingis_trade/,60,1561437879.0,"When the porzingis trade happened, Knicks fans were fast to say that it’s because the Knicks are signing huge free agents in the off season. The chances of kd and kyrie going to the Knicks looks very slim now, especially after igoudala’s statement. Did the Knicks really just f up that bad and trade porzingis for no reason?",It's not their fault KD tore his Achilles.,"This post reeks on shitting on the Knicks.

We get it, the move was ballsy but it has silver lining to it",2019-06-25 07:44:39
153,"[Stein] The four teams Porzingis had on his wish list of trade destinations were the Nets, Los Angeles Clippers, Miami Heat and Toronto Raptors",622,aqnhyd,https://www.reddit.com/r/nba/comments/aqnhyd/stein_the_four_teams_porzingis_had_on_his_wish/,226,1550200992.0,"Context:

>The four teams Porzingis had on his wish list of trade destinations were the Nets, Los Angeles Clippers, Miami Heat and Toronto Raptors, according to two people with knowledge of the list who were not authorized to discuss it publicly. The Knicks, of course, traded Porzingis to the Mavericks.

https://static.nytimes.com/email-content/MSB_10220.html?nlid=60638453",If he went to the Nets NY woulda exploded ,It's pretty crazy the Clippers are on everyone's list now. ,2019-02-15 05:23:12
154,"[Fisher] I'm told there is no 'conspiratorial' reason for Porzingis sitting out rest of Mavs year. Nor is it about his knee, exactly. It's about a 'physical makeover' - getting his body stronger so future injuries are less likely.",721,an95sz,https://www.reddit.com/r/nba/comments/an95sz/fisher_im_told_there_is_no_conspiratorial_reason/,176,1549360478.0,"Earlier today in the press conference Cuban and Porzingis confirmed that he would not be playing this season. This seemed to run contrary to previous reports from Stefan Bondy that he was ""essentially cleared to play"" at first, but perhaps there is no inconsistency there after all.

[In the documentary released about his recovery, the doctor mentions that the ACL tear was clean and that no other ligaments or tendons were affected, but that he would be best served by changing his biomechanics so that he can lessen the chances of re-injury.](https://youtu.be/ZPxsK1mQnhQ) 

To be sure, KP even before the ACL tear had a litany of lower body injuries that did not bode well. On top of that, he had trouble sustaining his production consistently throughout the year. Hopefully taking time off to develop his body further will make these concerns a thing of the past. The Mavs are certainly counting on it, as they prepare to offer the max. 

Source: https://twitter.com/fishsports/status/1092599713906475015",Porzingis spending some time in the hyperbolic chamber,"I mean, that really would be smart.

KP biggest issue was his body. Dude got tired after 25~ games every year.",2019-02-05 11:54:38
155,"[Stein] The Knicks spent January quietly canvassing the league for potential Porzingis trades, according to a person familiar with the talks who was not authorized to discuss them publicly. They tried for Utah’s Donovan Mitchell and Sacramento’s De’Aaron Fox and, predictably, were rebuffed.",751,anhweh,https://www.reddit.com/r/nba/comments/anhweh/stein_the_knicks_spent_january_quietly_canvassing/,278,1549424850.0,"This is from Marc Stein's latest newsletter form the NY Times, which is a great read on how the trade went down.

Other nuggets from the newsletter are:

- the Mavs have been calling the Knicks about Porzingis for years

- the Knicks have expressed interest in DSJ all season

- the Mavs were ready to do the deal after their game in New York, but Porzingis and his agent/brother Janis requested a meeting the next morning

- Janis and his camp provided the Knicks with a list of four teams they would consider acceptable trade destinations which included the Nets and Clippers (the Mavs were not on the list)

- execs around the league believe the Knicks have inside information about the motivations of KD and Kyrie

- there is real concern within the Warriors that the Knicks will persuade KD to leave

Source: https://static.nytimes.com/email-content/MSB_10011.html",">the Mavs were not on the list

Knicks didn't give a shit where he wanted to go","Oh, so they didn't arrange it in the hour after Porzingis demanded a trade?  Shocking.",2019-02-06 05:47:30
156,Porzingis says tomorrow will be his first 5v5 practice tomorrow with no restrictions,667,b0fu4z,https://streamable.com/wqvuz,95,1552468043.0,,"### **Replays/alternate angles**
                


*I am a bot, and this action was performed automatically. Please [contact the moderators of this subreddit](/message/compose/?to=/r/nba) if you have any questions or concerns.*",it'd be cool to see him play a few games at the end of the season to get acquainted before having the full off season to train like PG did,2019-03-13 11:07:23
157,"[Nahmad] Kristaps Porzingis will not reach the “starter criteria” prior to restricted free agency next summer. His qualifying offer will therefore fall from $7.5M to $4.5M. If he signs it, he'll be an unrestricted free agent in 2020.",814,alua8b,https://twitter.com/AlbertNahmad/status/1091081296200327173,186,1548997850.0,,Injury prone big men taking the qualifying offer from Dallas has never backfired before right?,"""It's when everything goes south, that's when you have to stay mentally strong and keep pushing forward."" -Kristaps Porzingis",2019-02-01 07:10:50
158,"Knicks President Steve Mills: “[Porzingis and his brother] made it clear to us, it was a meeting they requested, and they made it clear to us that he did not want to play for the Knicks, he was not going to sign with us a free agent.”",826,amshz1,https://www.reddit.com/r/nba/comments/amshz1/knicks_president_steve_mills_porzingis_and_his/,252,1549248338.0,"Full Tweetstorm:

>Speaking with @RebeccaHaarlow on @MSGNetworks, Knicks president Steve Mills says the Knicks had “about eight potential scenarios” with other teams regarding trades for Kristaps Porzingis

>Mills says that trading Porzingis by the Feb. 7th trade deadline very impritant because the Knicks would lose leverage if KP was still unhappy and still in the roster after the deadline

>Mills: “[Porzingis and his brother] made it clear to us, it was a meeting they requested, and they made it clear to us that he did not want to play for the Knicks, he was not going to sign with us a free agent.”

>More Steve Mills: “in one way, we thanked [Porzingis] for the clarity because it gave us the information we needed.”

>Mills said that because of previous conversations with teams, they knew exactly which direction they wanted to head once KP said he would g commit long term.

https://twitter.com/TommyBeer/status/1092129061541998593

[Video](https://streamable.com/h6ox0)",[deleted],"Lonzo's dad

Kawhi's uncle

Porzingis' brother

who's next?",2019-02-04 04:45:38
159,Kristaps Porzingis requested a trade because the Knicks didn’t give his brother Janis a big role with the team,487,anm4dq,https://www.reddit.com/r/nba/comments/anm4dq/kristaps_porzingis_requested_a_trade_because_the/,272,1549450402.0,"Marc Berman has some interesting notes in his newest article, including Kristaps preferred landing spots:

The Spurs, Nets, Clippers, and Raptors ([source](https://nypost.com/2019/02/05/kristaps-porzingis-brother-wanted-a-bigger-role-with-knicks/)

> Janis, who had a modest European playing career, wanted to be a bigger part of the Knicks’ team, too. According to sources, Janis asked for jobs for some members of Porzingis’ entourage. But nothing ever materialized.

> It’s not uncommon for these type of jobs to be granted to a team’s superstar. When Carmelo Anthony was a Knick, Asani Swann was on the Knicks payroll with an official position, director of player relations. Swann was Anthony’s longtime branding manager and worked solely with Anthony.

>Amare Stoudemire’s security man, Max Cayard, was named to the Knicks security staff soon after Stoudemire signed. When Anthony and Stoudemire moved on, so did Swann and Cayard.

> Ultimately, Knicks brass could never satisfy Janis, whom Kristaps believes in fully. Janis felt the franchise, based on its history with Steve Mills’ past performance, was not moving in a winning direction.

Another interesting one: Knicks could’ve traded Porzingis for Booker and Markannen but Phil was turned down by Mills/Dolan

> “Janis wanted the kingdom,’’ one source familiar with the situation told The Post.",See u later Uncle Janis ,I believe this because Mark Cuban said in the introduction press conference for K.P that his brother will be a part of the team. ,2019-02-06 12:53:22
160,[Kennedy] I texted a few NBA players about this Kristaps Porzingis trade. Most hadn't heard the news yet and thought it was fake. A lot of rival players are stunned right now.,1483,alu8wc,https://www.reddit.com/r/nba/comments/alu8wc/kennedy_i_texted_a_few_nba_players_about_this/,175,1548997657.0,"Seriously, this trade is such a stunner that even NBA players can't believe it. Kristaps just requested a trade, the Knicks trade him just like that, and this is what they agreed to take in return? Absolute shocker. Nice job Dolan! Sorry Knicks fans.

https://twitter.com/AlexKennedyNBA/status/1091079503756050432",He’s just flexing about having their numbers,Man. Fuck the western conference can't some of you take a knee and suck for awhile.,2019-02-01 07:07:37
161,[Price] Porzingis very anxious to join Doncic on the court and “really take this thing to the next level”,595,apymzw,https://www.mavs.com/porzingis-very-anxious-to-join-doncic-on-the-court-and-really-take-this-thing-to-the-next-level/,146,1550036347.0,,"I hope he plays just on the last game of the season so we see Dirk, Luka, and KP all in an NBA game at the same time",imagine how anxious he'll be the first time they have sex,2019-02-13 07:39:07
162,[Fisher] Smartest legal minds I know suggesting to me that #Porzingis side may have been advised by FBI to record rape accuser’s exchanges .. a ‘sting’ of sorts to establish truth of their relationship & her intentions. #Mavs @1053thefan,89,b84ldz,https://twitter.com/fishsports/status/1112740612510572544?s=21&,104,1554164678.0,,"The smartest legal minds with the best brains and biggest intelligence, believe me ",If you're famous and live in a 1 party state you should record everything,2019-04-02 03:24:38
163,[serious] Would Kemba or Vucevic compliment Doncic and Porzingis better?,9,brx5pa,https://www.reddit.com/r/nba/comments/brx5pa/serious_would_kemba_or_vucevic_compliment_doncic/,61,1558604028.0,"Is kemba the right guy for the Mavs to give 120 million dollars to? Great player but he likes having the ball. 

I assume for the development of Doncic he should have the ball in his hands as much as possible?","REMINDER: This thread is only for serious and thought-provoking analysis. We ask users to report low effort comments that do not bring insightful discussion. Temporary bans may be handed out to users who post memes and other low-effort or off-topic comments in this thread.

*I am a bot, and this action was performed automatically. Please [contact the moderators of this subreddit](/message/compose/?to=/r/nba) if you have any questions or concerns.*","Kemba, much better player for the same price.",2019-05-23 12:33:48
164,"[Begley] NBPA statement from executive director Michele Roberts on the Kristaps Porzingis rape allegations: “We have been aware of these allegations for some time, have evaluated the accuser’s claims and, based on what is presently before us, stand with Kristaps.”",268,b7v9t9,https://twitter.com/ianbegley/status/1112517674024734720?s=21,57,1554109200.0,,Get me off this rollercoaster I just want to know the truth,> I'm siding with my employers,2019-04-01 12:00:00
165,"[Wojnarowski] Kristaps Porzingis, who can become a restricted free agent this summer, has yet to make a decision on his future with Dallas, league sources tell ESPN. He expects to start the process of getting to know the organization soon. Porzingis will continue to rehab his ACL injury.",961,alujei,https://twitter.com/wojespn/status/1091087496509833216,218,1548999318.0,,Cmon KP dont do this to us,WOJ GOING FOR SHAMS MANHOOD,2019-02-01 07:35:18
166,[Price] Porzingis and Luka chatting it up after the Mavs' practice today at American Airlines Center. @dallasmavs #Mavs @NBA,398,an4imy,https://streamable.com/lfd3h,165,1549333199.0,,"### **Replays/alternate angles**
                


*I am a bot, and this action was performed automatically. Please [contact the moderators of this subreddit](/message/compose/?to=/r/nba) if you have any questions or concerns.*",[deleted],2019-02-05 04:19:59
167,"Zach Lowe speaking on the Porzingis trade with Ian Begley: ""I don’t think he was psyched about playing with Durant.""",286,atn880,https://www.reddit.com/r/nba/comments/atn880/zach_lowe_speaking_on_the_porzingis_trade_with/,174,1550900338.0,"Zach Lowe brings up:

>The Knicks probably looked at it as ""you're unhappy all the time, your people constantly voice that you're unhappy, you voice it a lot, we're done.  We think we've done a good job setting up the team for the future, you're a great player.  We'd love that future to involve you.  But we can get a good deal, we're done.""

Knicks beat reporter Ian Begley then goes on to talk about the Phil Jackson regime and how they may have tried to force a push the summer they signed Derrick Rose, Courtney Lee, and Joakim Noah when they probably should have just blown it up to build around Kristaps.  It may have given the Knicks guidance to decide that they shouldn't try to force the issue with somebody who doesn't want to be there and to just get the best return for him and move forward.

Lowe later brings up:

>“I don’t think, I'm confident after talking to a lot of people, I don't think he was psyched about playing with Durant. I don’t know how directly that was verbalized to the Knicks, but I’m confident that it wasn’t something that was his Plan A, he wanted to be the face of the franchise.  Kemba Walker would not be.  You could argue Kyrie Irving would not be, it would be close.  Kawhi Leonard is so quiet, even if he's the best player on the team (which he would be), he yields the public stage to other people.”

Begley responds talking about the meeting saying that he knows the meeting didn't take long and he doesn't get the sense that there was a desperate attempt by the Knicks to say ""Kristaps, please stay"" or of trying to mend fences, further elaborating that he thinks they were ready to pull the trigger because they knew he was unhappy and were prepared for it.  There were also multiple teams that would have been ready to put an offer on the table for Kristaps had they known, but the Knicks pulled the trigger so quickly that they couldn't.  He further elaborates that he doesn't think the offers they could have put out would accomplish all 3 goals the Knicks wanted, which was cap space, a young player, and pick(s).  

Begley also brings up: 

>“I always got the impression that he would’ve welcomed Kyrie and been excited about Kyrie.”

---

Kristaps' list of places he wanted to be traded was reported as the Nets, Clippers, Heat, Spurs, and Raptors.  Notably, Kristaps responded on Instagram the night of the trade telling Knicks fans to ""stay woke"", and that ""the truth will come out eventually"".

---

Link to the podcast: http://www.espn.com/espnradio/play?id=26056257","So he was tired of losing, but didn't want to play with KD?",We got a bunch of wannabe Batmans but no one wants to be Robin.,2019-02-23 07:38:58
168,Compression Shirt Porzingis or no,0,ccfiid,https://www.reddit.com/r/nba/comments/ccfiid/compression_shirt_porzingis_or_no/,8,1562988873.0,Do you guys think Porzingis will bring back the compression shirt under his jersey like he did in NY a few years back?,"Idk, I've been sweating over this for weeks. I'm awaiting his announcement soon.",donn care,2019-07-13 06:34:33
169,[New York Times] One person briefed on the trade call between the teams and who was not authorized to discuss it publicly expressed the belief on Monday that the N.B.A. would not have allowed the trade to go through if the case against Porzingis appeared to be strong.,79,b8shhf,https://twitter.com/nytsports/status/1113239209240928257?s=21,57,1554287857.0,,"Adam Silver quoting Bob Kelso on conference call with Mavs and Knicks ""bitches huh...what you gonna do?""","Reading her emails and texts that Woj posted in his story makes me strongly doubt it honestly. 

The document he supposedly signed had his own god damn name spelled wrong and when they asked for the original document so they could do handwriting analysis she refused. ",2019-04-03 13:37:37
170,[TheScore]Pelicans rejected Knicks offer of Porzingis for Davis straight up.,556,anai0s,https://twitter.com/theScore/status/1092636033991262208,216,1549369704.0,,Not that crazy imo dude is an injury prone big ,am I missing something here? there's nothing wrong with the Pelicans turning this down,2019-02-05 14:28:24
171,"[Wojnarowski] Kristaps Porzingis' attorney Roland G. Riopelle tells ESPN: ""We have been contacted by (New York County) the District Attorney's office and we are cooperating fully with their investigation. We have agreed to provide the District Attorney's Office with the materials..."" (more)",154,b8550q,https://twitter.com/wojespn/status/1112763115442188289?s=21,60,1554167212.0,,"[[Wojnarowski] More from Riopelle: ""...that we previously provided to the federal authorities in support of our extortion complaint. We are confident that, after the District Attorney reviews these materials, they will recognize that the complaint made in this case is completely meritless.""](https://twitter.com/wojespn/status/1112763643291156481?s=21)",Those twitter comments  make the average poster on /r/nba look like Einstein.,2019-04-02 04:06:52
172,First look at Kristaps Porzingis in a Dallas Mavericks jersey,565,an89he,https://imgur.com/gallery/iu4Aafg,128,1549354623.0,,Jen Selter gonna be front row in Dallas now too,His ACL appears to be intact 👀,2019-02-05 10:17:03
173,"[Wojnarowski] New Orleans rejected the Knicks on a Porzingis offer recently, and likely don't have the assets to gain the Pelicans' interest unless they defy the odds on a 12 percent chance in the draft lottery to get the No. 1 overall pick in the June draft.",538,an571f,https://twitter.com/wojespn/status/1092503566449815553,134,1549336928.0,,"I think this list makes it even more clear that he wants the Lakers. The Bucks and the Knicks can't beat their offer. 

He also took Boston out of the equation which leaves the Lakers with basically no competition.",14 percent asshole,2019-02-05 05:22:08
174,Porzingis Games Played vs. Salary Maths,9,c7qdwn,https://www.reddit.com/r/nba/comments/c7qdwn/porzingis_games_played_vs_salary_maths/,6,1562001429.0,"Porzingis played a total of 186 games in the NBA and earned $18,650,094, that averages to $100,000 a game on a rookie deal.  He  just signed a 158 million dollar contract.  A fully guaranteed contract.  I wonder what r/NBA will think about this contract 5 years from now.  How many games do you think he will play? Will he be effective?  Will he have team/chemistry issues? Will the Mavs regret this trade & max?","He seems to love Luka and Dallas from what I’ve seen on his Instagram. Dallas also had to make this gamble and max him after they traded for him earlier this year. 

I think a lot of people are forgetting about him since he was dealt a while back, just think if this was breaking news today, a lot of people would be going crazy. If Dallas can build a solid team around him and Luka they could easily compete year in year out for a championship.",He will lead the Mavs to a championship within 5 years,2019-07-01 20:17:09
175,[SI]The Knicks reportedly tried trading Kristaps Porzingis to the Kings for De'Aaron Fox before last year's draft,180,b5v97u,https://www.reddit.com/r/nba/comments/b5v97u/sithe_knicks_reportedly_tried_trading_kristaps/,57,1553663022.0,"Context:

>The Knicks dealt Kristaps Porzingis to the Mavericks ahead of the February trade deadline, but a new ESPN report suggests a different deal could have been made before the 2018 NBA draft last June. 

ESPN's Zach Lowe reports the Knicks were in talks with the Kings for De'Aaron Fox despite his struggles during his rookie season. In the leadup to last year's draft, the Kings who had the No. 2 pick were interested in drafting Luka Doncic to rebuild the team around the him.

""Rivals sensed the dilemma and made offers for Fox — including a template from the New York Knicks centered around Kristaps Porzingis that would have required Sacramento to either send something beyond Fox or take unwanted Knicks salary (or both), sources say,"" Lowe wrote. 

The Kings picked Marvin Bagley III with the No. 2 pick in the 2018 NBA draft. 

Doncic now plays with Porzingis in Dallas after going No. 3 overall in the 2018 NBA draft. The Knicks received point guard Dennis Smith Jr. and center DeAndre Jordan in exchange for Porzingis.

Fox is averaging 17.4 points and 7.2 assists per game this season, while the Kings are 36–37 and sit in ninth in the Western Conference.

[Link](https://www.si.com/nba/2019/03/26/knicks-tried-trading-kristaps-porzingis-kings-deaaron-fox?utm_source=twitter.com&utm_medium=social&xid=socialflow_twitter_si&utm_campaign=sinow)

","keep in mind scott perry was our VP of basketball ops when we drafted de'aaron

",Fox is too damn good.,2019-03-27 07:03:42
176,"[Goodwill] ""The Knicks were worried about Porzingis’ brother, Janis, who’s been more involved in Kristaps’ affairs and wanted to make demands to the front office about acquiring certain players, sources told Yahoo Sports.""",388,alwhjn,https://www.reddit.com/r/nba/comments/alwhjn/goodwill_the_knicks_were_worried_about_porzingis/,171,1549012013.0,">There were concerns about giving Porzingis a full max contract because of his injury, league sources told Yahoo Sports, and there were concerns off the floor.

>The Knicks were worried about Porzingis’ brother, Janis, who’s been more involved in Kristaps’ affairs and wanted to make demands to the front office about acquiring certain players, sources told Yahoo Sports. When the front office pushed back, the doubts about Porzingis having a future in New York came into play.

>Porzingis has been out all season, recovering from an ACL injury he suffered last February, and although he probably should’ve been ready to play already, there was no indication he was going to see the floor this season.

Source: https://www.yahoo.com/amphtml/sports/kristaps-porzingis-trade-shows-confident-knicks-landing-superstar-free-agent-233633220.html?__twitter_impression=true","Brother Janis > Uncle Dennis, dont @ me",All the focus has been on Kawhi’s Uncle but KP’s brother has been shit stirring discretely for a while now. ,2019-02-01 11:06:53
177,[Yahoo Sports] Mark Cuban urges 'common sense' with Kristaps Porzingis rape allegation,66,b9h6q4,https://www.yahoo.com/sports/mark-cuban-urges-common-sense-with-kristaps-porzingis-rape-allegation-003547656.html,71,1554434860.0,,"""Use your common sense guys use your brains!!! Stop it. You all quit playing! Quit playing! I didn't do this stuff! This is not me! I'm fighting for my fucking life! Y'all killing me with this shit!""

sounds familiar","Common sense would be for Cuban to not comment on the allegation. And definitely don't comment while wearing a shit-eating grin.

>“I will say this,” Cuban said with a grin on his face. “Some people need to do their homework and use some common sense. A little bit of common sense is so enlightening.”

>When asked to elaborate on what he meant by common sense, Cuban again smiled and said “just general things, topics. It’s so enlightening.”",2019-04-05 06:27:40
